{
  "schema_version": "1.0",
  "title": "Test Story",
  "created": "2025-10-01T13:23:43.355024+00:00",
  "modified": "2025-10-01T13:23:43.355058+00:00",
  "config": {
    "auto_export": false,
    "fact_categories": [
      "trait",
      "relationship",
      "knowledge",
      "event",
      "state"
    ],
    "lsp_integration": false
  }
}